{
 "version": 1,
 "item": {
  "id": "california-fire-warning",
  "title": "California fire warning",
  "source": "VOA newscast 2025-01-20 via Internet Archive (public domain)",
  "lane": "curated",
  "broadcast_date": "2025-01-20"
 },
 "media": {
  "kind": "audio",
  "url": "app/static/news/california-fire-warning.wav",
  "duration_s": 27.17
 },
 "playback": {
  "mode": "interpreter-paced",
  "sign_rate": 1.25,
  "letter_rate": 2.0,
  "text_hold_s": 0.9
 },
 "sentences": [
  {
   "index": 0,
   "t_start": 0.25,
   "t_end": 14.03
  },
  {
   "index": 1,
   "t_start": 14.03,
   "t_end": 27.17
  }
 ],
 "captions": [
  {
   "t": 0.25,
   "text": "Southern",
   "sentence": 0
  },
  {
   "t": 0.57,
   "text": "Californians",
   "sentence": 0
  },
  {
   "t": 1.59,
   "text": "are",
   "sentence": 0,
   "dropped": true
  },
  {
   "t": 1.71,
   "text": "again",
   "sentence": 0
  },
  {
   "t": 1.97,
   "text": "bracing",
   "sentence": 0
  },
  {
   "t": 2.61,
   "text": "for",
   "sentence": 0,
   "dropped": true
  },
  {
   "t": 2.85,
   "text": "gusty",
   "sentence": 0
  },
  {
   "t": 3.45,
   "text": "winds",
   "sentence": 0
  },
  {
   "t": 3.73,
   "text": "and",
   "sentence": 0
  },
  {
   "t": 4.11,
   "text": "a",
   "sentence": 0,
   "dropped": true
  },
  {
   "t": 4.31,
   "text": "heightened",
   "sentence": 0
  },
  {
   "t": 4.71,
   "text": "risk",
   "sentence": 0
  },
  {
   "t": 5.15,
   "text": "of",
   "sentence": 0,
   "dropped": true
  },
  {
   "t": 5.41,
   "text": "wildfires",
   "sentence": 0
  },
  {
   "t": 6.23,
   "text": "less",
   "sentence": 0
  },
  {
   "t": 6.55,
   "text": "than",
   "sentence": 0,
   "dropped": true
  },
  {
   "t": 6.85,
   "text": "two",
   "sentence": 0
  },
  {
   "t": 7.09,
   "text": "weeks",
   "sentence": 0
  },
  {
   "t": 7.37,
   "text": "after",
   "sentence": 0
  },
  {
   "t": 7.65,
   "text": "the",
   "sentence": 0,
   "dropped": true
  },
  {
   "t": 7.95,
   "text": "start",
   "sentence": 0
  },
  {
   "t": 8.19,
   "text": "of",
   "sentence": 0,
   "dropped": true
  },
  {
   "t": 8.33,
   "text": "deadly",
   "sentence": 0
  },
  {
   "t": 8.61,
   "text": "blazes",
   "sentence": 0
  },
  {
   "t": 9.33,
   "text": "that",
   "sentence": 0,
   "dropped": true
  },
  {
   "t": 9.65,
   "text": "have",
   "sentence": 0,
   "dropped": true
  },
  {
   "t": 9.77,
   "text": "killed",
   "sentence": 0
  },
  {
   "t": 9.95,
   "text": "at",
   "sentence": 0,
   "dropped": true
  },
  {
   "t": 10.17,
   "text": "least",
   "sentence": 0
  },
  {
   "t": 10.31,
   "text": "27",
   "sentence": 0
  },
  {
   "t": 11.01,
   "text": "people",
   "sentence": 0
  },
  {
   "t": 11.47,
   "text": "and",
   "sentence": 0
  },
  {
   "t": 11.69,
   "text": "destroyed",
   "sentence": 0
  },
  {
   "t": 12.01,
   "text": "thousands",
   "sentence": 0
  },
  {
   "t": 12.59,
   "text": "of",
   "sentence": 0,
   "dropped": true
  },
  {
   "t": 13.09,
   "text": "homes.",
   "sentence": 0
  },
  {
   "t": 14.03,
   "text": "The",
   "sentence": 1,
   "dropped": true
  },
  {
   "t": 14.54,
   "text": "U.S.",
   "sentence": 1
  },
  {
   "t": 15.05,
   "text": "National",
   "sentence": 1
  },
  {
   "t": 15.05,
   "text": "Weather",
   "sentence": 1
  },
  {
   "t": 15.25,
   "text": "Service",
   "sentence": 1
  },
  {
   "t": 15.73,
   "text": "has",
   "sentence": 1,
   "dropped": true
  },
  {
   "t": 15.97,
   "text": "issued",
   "sentence": 1
  },
  {
   "t": 16.31,
   "text": "a",
   "sentence": 1,
   "dropped": true
  },
  {
   "t": 16.45,
   "text": "red",
   "sentence": 1
  },
  {
   "t": 16.69,
   "text": "flag",
   "sentence": 1
  },
  {
   "t": 16.99,
   "text": "warning",
   "sentence": 1
  },
  {
   "t": 17.59,
   "text": "signaling",
   "sentence": 1
  },
  {
   "t": 18.13,
   "text": "increased",
   "sentence": 1
  },
  {
   "t": 18.87,
   "text": "fire",
   "sentence": 1
  },
  {
   "t": 19.35,
   "text": "danger",
   "sentence": 1
  },
  {
   "t": 19.89,
   "text": "for",
   "sentence": 1,
   "dropped": true
  },
  {
   "t": 20.33,
   "text": "Los",
   "sentence": 1
  },
  {
   "t": 20.65,
   "text": "Angeles",
   "sentence": 1
  },
  {
   "t": 20.97,
   "text": "on",
   "sentence": 1,
   "dropped": true
  },
  {
   "t": 21.47,
   "text": "Monday",
   "sentence": 1
  },
  {
   "t": 21.83,
   "text": "and",
   "sentence": 1
  },
  {
   "t": 22.13,
   "text": "Tuesday",
   "sentence": 1
  },
  {
   "t": 22.43,
   "text": "due",
   "sentence": 1
  },
  {
   "t": 23.07,
   "text": "to",
   "sentence": 1
  },
  {
   "t": 23.19,
   "text": "low",
   "sentence": 1
  },
  {
   "t": 23.51,
   "text": "humidity",
   "sentence": 1
  },
  {
   "t": 23.95,
   "text": "and",
   "sentence": 1
  },
  {
   "t": 24.41,
   "text": "warm,",
   "sentence": 1
  },
  {
   "t": 24.97,
   "text": "dry",
   "sentence": 1
  },
  {
   "t": 25.31,
   "text": "Santa",
   "sentence": 1
  },
  {
   "t": 25.79,
   "text": "Ana",
   "sentence": 1
  },
  {
   "t": 26.23,
   "text": "winds.",
   "sentence": 1
  }
 ],
 "entries": [
  {
   "onset_s": 0.25,
   "sentence": 0,
   "word": "weeks",
   "gloss": "WEEK",
   "badge": "validated",
   "clips": [
    {
     "url": "app/static/clips/week.mp4",
     "duration_s": 2.602,
     "in_s": 0.467,
     "out_s": 2.602,
     "rate": 1.25,
     "source": "cats",
     "licence": "Public Domain",
     "attribution_url": "https://archive.org/details/weekASL"
    }
   ]
  },
  {
   "onset_s": 0.25,
   "sentence": 0,
   "word": "southern",
   "gloss": "SOUTH",
   "badge": "validated",
   "clips": [
    {
     "url": "app/static/clips/south.mp4",
     "duration_s": 2.602,
     "in_s": 0.6,
     "out_s": 2.602,
     "rate": 1.25,
     "source": "cats",
     "licence": "Public Domain",
     "attribution_url": "https://archive.org/details/southASL"
    }
   ]
  },
  {
   "onset_s": 0.57,
   "sentence": 0,
   "word": "californians",
   "gloss": "CALIFORNIA",
   "badge": "validated",
   "clips": [
    {
     "url": "app/static/clips/california.mp4",
     "duration_s": 2.702,
     "in_s": 0.3,
     "out_s": 2.702,
     "rate": 1.25,
     "source": "cats",
     "licence": "Public Domain",
     "attribution_url": "https://archive.org/details/californiaASL"
    }
   ]
  },
  {
   "onset_s": 1.71,
   "sentence": 0,
   "word": "again",
   "gloss": "AGAIN",
   "badge": "validated",
   "clips": [
    {
     "url": "app/static/clips/again.mp4",
     "duration_s": 3.502,
     "in_s": 0.0,
     "out_s": 3.502,
     "rate": 1.25,
     "source": "cats",
     "licence": "Public Domain",
     "attribution_url": "https://archive.org/details/againASL"
    }
   ]
  },
  {
   "onset_s": 1.97,
   "sentence": 0,
   "word": "bracing",
   "gloss": "PREPARE",
   "badge": "validated",
   "clips": [
    {
     "url": "app/static/clips/prepare.mp4",
     "duration_s": 2.302,
     "in_s": 0.6,
     "out_s": 2.302,
     "rate": 1.25,
     "source": "cats",
     "licence": "Public Domain",
     "attribution_url": "https://archive.org/details/readyASL"
    }
   ]
  },
  {
   "onset_s": 2.85,
   "sentence": 0,
   "word": "gusty",
   "gloss": "WIND",
   "badge": "validated",
   "clips": [
    {
     "url": "app/static/clips/wind.mp4",
     "duration_s": 2.169,
     "in_s": 0.067,
     "out_s": 2.169,
     "rate": 1.25,
     "source": "cats",
     "licence": "Public Domain",
     "attribution_url": "https://archive.org/details/windwindyASL"
    }
   ]
  },
  {
   "onset_s": 3.45,
   "sentence": 0,
   "word": "winds",
   "gloss": "WIND",
   "badge": "validated",
   "clips": [
    {
     "url": "app/static/clips/wind.mp4",
     "duration_s": 2.169,
     "in_s": 0.067,
     "out_s": 2.169,
     "rate": 1.25,
     "source": "cats",
     "licence": "Public Domain",
     "attribution_url": "https://archive.org/details/windwindyASL"
    }
   ]
  },
  {
   "onset_s": 3.73,
   "sentence": 0,
   "word": "and",
   "gloss": "AND",
   "badge": "validated",
   "clips": [
    {
     "url": "app/static/clips/and.mp4",
     "duration_s": 2.402,
     "in_s": 0.234,
     "out_s": 2.402,
     "rate": 1.25,
     "source": "cats",
     "licence": "Public Domain",
     "attribution_url": "https://archive.org/details/plusASL"
    }
   ]
  },
  {
   "onset_s": 4.31,
   "sentence": 0,
   "word": "heightened",
   "gloss": "INCREASE RISK",
   "badge": "validated",
   "clips": [
    {
     "url": "app/static/clips/increase-risk.mp4",
     "duration_s": 2.035,
     "in_s": 0.0,
     "out_s": 1.902,
     "rate": 1.25,
     "source": "cats",
     "licence": "Public Domain",
     "attribution_url": "https://archive.org/details/biggerlargergreaterASL"
    }
   ]
  },
  {
   "onset_s": 4.71,
   "sentence": 0,
   "word": "risk",
   "gloss": "DANGER",
   "badge": "validated",
   "clips": [
    {
     "url": "app/static/clips/danger.mp4",
     "duration_s": 2.902,
     "in_s": 0.6,
     "out_s": 2.902,
     "rate": 1.25,
     "source": "cats",
     "licence": "Public Domain",
     "attribution_url": "https://archive.org/details/riskASL"
    }
   ]
  },
  {
   "onset_s": 5.41,
   "sentence": 0,
   "word": "wildfires",
   "gloss": "FIREstr",
   "badge": "validated",
   "clips": [
    {
     "url": "app/static/clips/fire.mp4",
     "duration_s": 2.536,
     "in_s": 0.567,
     "out_s": 2.302,
     "rate": 1.25,
     "source": "signbank",
     "licence": "CC BY-NC-SA 4.0",
     "attribution_url": "https://aslsignbank.com/dictionary/gloss/457.html"
    }
   ]
  },
  {
   "onset_s": 6.23,
   "sentence": 0,
   "word": "less",
   "gloss": "LESS",
   "badge": "validated",
   "clips": [
    {
     "url": "app/static/clips/less.mp4",
     "duration_s": 4.103,
     "in_s": 1.001,
     "out_s": 4.103,
     "rate": 1.25,
     "source": "cats",
     "licence": "Public Domain",
     "attribution_url": "https://archive.org/details/lessunderASL"
    }
   ]
  },
  {
   "onset_s": 6.85,
   "sentence": 0,
   "word": "two",
   "gloss": "TWO",
   "badge": "validated",
   "clips": [
    {